{
  "source": "sample_010",
  "platform": "dcard_manual",
  "category": "relationship",
  "raw_text": "他有時候會約我出去，也會跟我說一些很曖昧的話，但我知道他同時也在跟別人聊天。每次他突然消失又回來，我都會懷疑自己是不是備胎。可是他一主動，我又很難不心軟。",
  "summary": "使用者因對方曖昧行為與同時跟他人聊天而產生備胎焦慮，但仍會因對方主動而心軟。",
  "emotion": "備胎焦慮",
  "emotion_intensity": 7,
  "pain_point": "使用者無法確定自己在對方心中的優先級，需要工具協助判斷對方的多線經營行為模式與真實投入度。",
  "pain_frequency": "中高頻，每當對方消失又回來或發現對方同時與他人互動時會被觸發。",
  "social_behavior": "明知對方多線經營仍持續回應，會在對方消失期間推測自己地位，但對方主動時容易心軟。",
  "identity_signal": "使用者展現對曖昧關係中自我價值的不確定感，擔心被視為備胎但仍渴望被選中。",
  "shareability_score": 9,
  "monetization_score": 7,
  "retention_score": 7,
  "possible_product": [
    "多線經營行為分析器",
    "備胎風險評估器",
    "曖昧優先級判斷器"
  ],
  "possible_hook": [
    "他同時跟很多人聊，你真的是備胎嗎？",
    "這些跡象可能代表你不是他的第一選擇。",
    "下次他消失又回來，先觀察這個。"
  ],
  "observed_patterns": [
    "間歇性主動與消失會讓使用者產生備胎焦慮。",
    "使用者明知對方多線經營仍難以拒絕，顯示情感依賴大於理性判斷。",
    "使用者需要客觀評估工具來確認自己在多角關係中的位置。"
  ],
  "timestamp": "2026-05-16T08:57:39.639877+00:00"
}
