{
  "source": "sample_007",
  "platform": "dcard_manual",
  "category": "relationship",
  "raw_text": "最近跟他聊天，他常常只回一個表情符號，或是「哈哈」「是喔」這種很短的句子。以前他明明會接話，也會問我問題。現在我每次打很多字都覺得自己像在獨角戲。",
  "summary": "使用者發現對方聊天變得敷衍，從以前的互動式對話變成短回覆，讓使用者感到像在獨角戲。",
  "emotion": "關係失控感",
  "emotion_intensity": 7,
  "pain_point": "使用者無法理解為什麼對方溝通模式突然改變，需要工具分析對話品質變化並提供應對建議，避免繼續單方面投入。",
  "pain_frequency": "每次聊天都會被觸發，特別是當使用者發長訊息卻只收到短回覆時。",
  "social_behavior": "持續發送長訊息試圖維持對話品質，同時觀察並記住對方回覆模式的變化。",
  "identity_signal": "使用者將對話品質視為關係品質的指標，擔心自己變得無趣或對方已失去興趣。",
  "shareability_score": 8,
  "monetization_score": 6,
  "retention_score": 7,
  "possible_product": [
    "對話品質分析器",
    "聊天模式變化偵測器",
    "話題救援建議器"
  ],
  "possible_hook": [
    "為什麼他突然只回表情符號？",
    "從「會接話」到「哈哈」，關係出了什麼問題？",
    "你的長訊息為什麼換來短回覆？"
  ],
  "observed_patterns": [
    "對話品質下降會被使用者解讀為關係降溫的明確訊號。",
    "回覆長度不對等容易讓使用者產生獨角戲感受。",
    "使用者會記住並比較過去的對話模式變化。"
  ],
  "timestamp": "2026-05-16T08:43:24.612583+00:00"
}
