{
  "source": "sample_003",
  "platform": "dcard_manual",
  "category": "relationship",
  "raw_text": "他有時候會突然很熱情，連續跟我聊到半夜，隔天又像消失一樣只回一兩句。每次我快要覺得他是不是喜歡我，他又突然變冷。我不知道這是他的個性，還是我只是他無聊時才會想到的人。",
  "summary": "使用者因對方忽冷忽熱的對話模式而無法判斷關係定位，在期待與失落間反覆循環。",
  "emotion": "忽冷忽熱焦慮",
  "emotion_intensity": 8,
  "pain_point": "使用者無法區分對方的忽冷忽熱是個性特質還是對自己興趣不足的表現，需要協助解讀這種不一致行為背後的可能原因。",
  "pain_frequency": "高頻，每次對方態度轉換時都會被觸發，通常是一天內多次的情緒起伏。",
  "social_behavior": "密切觀察對方回訊的熱絡程度與頻率變化，並用這些變化推測自己在對方心中的重要性。",
  "identity_signal": "擔心自己只是對方無聊時的消遣，反映對自我價值與在關係中地位的不確定感。",
  "shareability_score": 9,
  "monetization_score": 9,
  "retention_score": 9,
  "possible_product": [
    "忽冷忽熱解讀器",
    "對話溫度追蹤器",
    "下一步互動建議器"
  ],
  "possible_hook": [
    "他對你忽冷忽熱，可能代表這三種心理狀態",
    "你不是備胎，但這個訊號要注意",
    "遇到忽冷忽熱的人，這樣回應最聰明"
  ],
  "observed_patterns": [
    "忽冷忽熱的互動模式會讓使用者在期待與失落間反覆循環。",
    "使用者更容易對不一致的關注度產生強烈情緒反應。",
    "對方態度的每次轉變都會觸發使用者重新評估關係定位的需求。"
  ],
  "timestamp": "2026-05-16T08:57:38.667887+00:00"
}
