{
  "source": "sample_002",
  "platform": "dcard_manual",
  "category": "relationship",
  "raw_text": "昨天他明明已讀了我的訊息，卻到今天都沒有回。可是他中間還有發限動跟按別人的貼文讚，讓我覺得自己是不是被故意放著。我一直想要不要再傳一次，但又怕看起來很卑微。",
  "summary": "使用者因對方已讀不回卻仍活躍在社群媒體上，感受到被刻意忽視，在追問與保持尊嚴間陷入掙扎。",
  "emotion": "已讀不回焦慮",
  "emotion_intensity": 9,
  "pain_point": "使用者需要判斷對方是否故意冷落自己，並決定要不要追問，但缺乏準確判斷標準且擔心顯得太過主動或卑微。",
  "pain_frequency": "高頻，每次看到對方有其他社群活動但不回訊息時會被觸發。",
  "social_behavior": "密切關注對方的限動更新、按讚活動與線上狀態，用來比對對方是否真的忙碌或只是不想回覆。",
  "identity_signal": "使用者擔心顯得卑微或太主動，反映對在關係中的地位與自尊的保護需求。",
  "shareability_score": 10,
  "monetization_score": 9,
  "retention_score": 9,
  "possible_product": [
    "已讀不回解讀器",
    "追問時機建議器",
    "社群活動vs回訊分析器"
  ],
  "possible_hook": [
    "他看別人貼文卻不回你訊息，代表什麼？",
    "已讀不回但發限動，要不要追問？",
    "這樣追問不會顯得卑微的方法。"
  ],
  "observed_patterns": [
    "使用者會用對方的社群活動狀態來判斷是否被故意忽視。",
    "已讀不回配合其他線上活動會加劇被冷落的感受。",
    "使用者在追問與保持尊嚴間需要明確的行動指引。"
  ],
  "timestamp": "2026-05-16T08:57:32.262002+00:00"
}
