{
  "source": "sample_005",
  "platform": "dcard_manual",
  "category": "relationship",
  "raw_text": "他平常白天幾乎不找我，但常常半夜十二點後才突然傳訊息說想聊天。有時候語氣又很曖昧，讓我不知道自己是不是被當成無聊時的陪聊。我想回又怕越陷越深。",
  "summary": "使用者因對方只在深夜主動聯繫且語氣曖昧，而困惑自己在對方心中的真實地位與價值。",
  "emotion": "關係定位不安",
  "emotion_intensity": 8,
  "pain_point": "使用者無法判斷對方的深夜聯繫是真心興趣還是無聊打發時間，需要協助解讀對方行為模式背後的真實動機與關係定位。",
  "pain_frequency": "中高頻，每次收到深夜訊息或考慮是否回應時都會被觸發。",
  "social_behavior": "在深夜收到曖昧訊息時會反覆思考對方動機，並在回應與保持距離之間猶豫不決。",
  "identity_signal": "使用者擔心自己只是對方無聊時的備胎選擇，反映對自身在關係中價值定位的不確定。",
  "shareability_score": 9,
  "monetization_score": 6,
  "retention_score": 7,
  "possible_product": [
    "深夜訊息動機分析器",
    "備胎指數檢測器",
    "曖昧行為模式解讀器"
  ],
  "possible_hook": [
    "他只在深夜找你聊天，代表什麼？",
    "你是真愛還是備胎？從聊天時間看出端倪",
    "半夜傳曖昧訊息的男生在想什麼？"
  ],
  "observed_patterns": [
    "深夜聯繫容易讓人產生備胎焦慮與關係定位困惑。",
    "時間模式會被解讀為對方重視程度的指標。",
    "使用者在曖昧關係中會因害怕投入過深而產生回應猶豫。"
  ],
  "timestamp": "2026-05-16T08:42:59.880888+00:00"
}
