{
  "source": "sample_001",
  "platform": "dcard_manual",
  "category": "relationship",
  "raw_text": "他最近回訊息變很慢，但還是會看我的限動。我不知道他是真的忙，還是其實已經沒那麼喜歡我了。每次看到他上線卻沒回我，我就一直想是不是我太主動。",
  "summary": "使用者因對方回訊變慢、仍觀看限動、上線卻不回而反覆解讀關係溫度。",
  "emotion": "曖昧不確定焦慮",
  "emotion_intensity": 8,
  "pain_point": "使用者無法判斷對方是忙、冷掉，還是在降低主動性，因此需要第三方協助解讀對話與互動訊號。",
  "pain_frequency": "高頻，通常會在每次看到上線、已讀、限動互動或回訊延遲時被觸發。",
  "social_behavior": "反覆查看對方上線狀態、限動觀看紀錄與回訊速度，並用這些微訊號推測對方投入度。",
  "identity_signal": "使用者擔心自己太主動、太在意，反映在曖昧關係中對自我價值與吸引力的不安。",
  "shareability_score": 9,
  "monetization_score": 7,
  "retention_score": 8,
  "possible_product": [
    "曖昧溫度計",
    "限動已讀但不回解讀器",
    "下一句怎麼回建議器"
  ],
  "possible_hook": [
    "他是真的忙，還是其實在冷掉？",
    "他看你限動卻不回訊息，代表什麼？",
    "你不是想太多，這些細節真的有訊號。"
  ],
  "observed_patterns": [
    "回訊速度變慢會被使用者解讀成關係降溫訊號。",
    "限動觀看與上線狀態容易成為曖昧焦慮的觸發點。",
    "使用者需要的是降低不確定性的互動解讀，而不是單純情緒安慰。"
  ],
  "timestamp": "2026-05-16T08:42:13.785435+00:00"
}
