{
  "source": "sample_008",
  "platform": "dcard_manual",
  "category": "relationship",
  "raw_text": "分手後我們沒有再聊天，但他幾乎每次都會看我的限動。有時候我發比較好看的照片，他也會很快就看。這讓我一直想他是不是還在意我，還是其實只是習慣性滑到而已。",
  "summary": "使用者因前任持續觀看限動、快速查看美照而反覆猜測對方是否仍有感情，還是只是習慣性行為。",
  "emotion": "分手後復合希望",
  "emotion_intensity": 7,
  "pain_point": "使用者無法區分前任的限動觀看行為是真實關注還是習慣性滑動，需要協助解讀分手後的微互動訊號以判斷復合可能性。",
  "pain_frequency": "高頻，每次發限動被前任觀看時都會被觸發，尤其是美照被快速查看時。",
  "social_behavior": "持續關注前任是否觀看限動，特別留意觀看速度與照片類型的關聯性，用這些微訊號推測前任心意。",
  "identity_signal": "使用者仍對前任抱有期待，透過限動互動尋求被在意的確認，反映對關係結束的不甘心。",
  "shareability_score": 8,
  "monetization_score": 6,
  "retention_score": 7,
  "possible_product": [
    "前任行為解讀器",
    "分手後復合機率計算機",
    "限動觀看模式分析器"
  ],
  "possible_hook": [
    "前任一直看你限動，代表什麼？",
    "他秒看你美照，是想復合還是習慣？",
    "分手後這些行為，其實有隱藏訊號"
  ],
  "observed_patterns": [
    "分手後的限動觀看行為容易被解讀成復合訊號。",
    "美照被快速觀看會強化使用者對前任仍有感情的推測。",
    "使用者需要的是客觀分析分手後互動行為的意義，而非情感建議。"
  ],
  "timestamp": "2026-05-16T08:43:36.374223+00:00"
}
