{
  "source": "sample_006",
  "platform": "dcard_manual",
  "category": "relationship",
  "raw_text": "他說最近很忙所以沒時間回訊息，可是我看到他還是有時間發文、回留言、跟朋友出去。我知道每個人都有自己的生活，但還是會忍不住想，忙是不是只是沒有那麼想回我的理由。",
  "summary": "使用者懷疑對方以忙碌為藉口不回訊息，因為觀察到對方仍有時間進行其他社交活動。",
  "emotion": "關係失控感",
  "emotion_intensity": 7,
  "pain_point": "使用者需要工具來客觀分析對方的真實優先級順序，區分「真忙」與「選擇性忙碌」的行為模式差異。",
  "pain_frequency": "中高頻，每當對方說忙但又觀察到其他活動時會被觸發。",
  "social_behavior": "監控對方的社交媒體活動、發文時間、出席狀況，並與回訊頻率進行對比分析。",
  "identity_signal": "擔心自己在對方心中的優先級過低，需要透過行為證據來驗證關係地位。",
  "shareability_score": 8,
  "monetization_score": 6,
  "retention_score": 7,
  "possible_product": [
    "忙碌藉口檢測器",
    "關係優先級分析器",
    "社交時間分配追蹤器"
  ],
  "possible_hook": [
    "他說很忙，但你看他還在發限動？",
    "真忙 vs 假忙，這些細節會說話",
    "你在他心中排第幾？行為模式告訴你答案"
  ],
  "observed_patterns": [
    "使用者會交叉比對對方的說詞與實際行為來判斷真實意圖。",
    "社交媒體活動成為驗證對方忙碌程度的重要指標。",
    "關係中的優先級焦慮需要客觀的行為分析工具來緩解。"
  ],
  "timestamp": "2026-05-16T08:43:12.915634+00:00"
}
