{
  "source": "sample_009",
  "platform": "dcard_manual",
  "category": "relationship",
  "raw_text": "我們平常會單獨出去，也會每天聊天，朋友都說我們看起來很像情侶。可是每次我想更進一步，他就會說現在這樣很好，不想破壞關係。我不知道自己到底是朋友，還是只是他不想承認的曖昧對象。",
  "summary": "使用者處於曖昧關係中，對方享受情侶式互動但拒絕正式交往，造成關係定位不明的困擾。",
  "emotion": "關係定位焦慮",
  "emotion_intensity": 8,
  "pain_point": "使用者無法確定自己在對方心中的定位，需要工具幫助判斷對方是真的想維持友誼，還是害怕承諾，或只是享受曖昧好處而不願負責。",
  "pain_frequency": "中高頻，每次互動後或想到關係未來時會被觸發，特別是在朋友詢問或看到其他情侶時。",
  "social_behavior": "持續參與情侶式的日常互動（單獨出遊、每日聊天），同時尋求外界對關係狀態的驗證與建議。",
  "identity_signal": "使用者渴望明確的關係標籤與承諾，反映對安全感和被重視程度的需求。",
  "shareability_score": 9,
  "monetization_score": 6,
  "retention_score": 7,
  "possible_product": [
    "曖昧關係定位分析器",
    "進一步表白時機判斷器",
    "對方真心度測試器"
  ],
  "possible_hook": [
    "他說不想破壞關係，到底是真心還是藉口？",
    "朋友都說你們像情侶，為什麼他不承認？",
    "享受曖昧好處卻不負責，這樣的人值得等嗎？"
  ],
  "observed_patterns": [
    "享受情侶互動但拒絕承諾的行為會造成對方關係定位困擾。",
    "外界觀感與當事人態度不一致時會加深使用者的混淆感。",
    "使用者更需要的是對方真實意圖的判斷工具，而非單純的情感支持。"
  ],
  "timestamp": "2026-05-16T08:43:50.477143+00:00"
}
