{
  "source": "sample_004",
  "platform": "dcard_manual",
  "category": "relationship",
  "raw_text": "前任最近突然回我限動，還問我最近過得好不好。分手後我們其實很久沒聯絡了，他這樣出現讓我心情很亂。我不知道他是真的想復合，還是只是寂寞才來找我。",
  "summary": "使用者因前任突然回覆限動並關心近況而感到困惑，無法判斷對方是想復合還是只是寂寞。",
  "emotion": "關係失控感",
  "emotion_intensity": 8,
  "pain_point": "使用者無法判斷前任突然聯絡的真實意圖，需要協助解讀前任行為背後的動機與可能性，避免錯誤解讀導致情緒起伏。",
  "pain_frequency": "中高頻，通常在前任有任何聯絡行為時被觸發，包括限動互動、訊息或共同朋友動態。",
  "social_behavior": "反覆分析前任的每個聯絡行為，試圖從限動回覆內容、頻率與時機推測復合可能性。",
  "identity_signal": "使用者在面對前任主動聯絡時展現出脆弱性，反映對過去關係的未完成情結與被選擇的不安。",
  "shareability_score": 9,
  "monetization_score": 6,
  "retention_score": 7,
  "possible_product": [
    "前任行為解讀器",
    "復合可能性評估工具",
    "前任聯絡意圖分析器"
  ],
  "possible_hook": [
    "前任突然關心你，是想復合還是只是寂寞？",
    "他回你限動真的有意思嗎？教你看懂前任訊號",
    "分手後他這樣做，代表什麼意思？"
  ],
  "observed_patterns": [
    "前任主動聯絡會讓使用者重新燃起希望與困惑。",
    "使用者需要第三方協助判斷前任行為的真實意圖。",
    "限動互動成為前任重新建立聯繫的常見管道。"
  ],
  "timestamp": "2026-05-16T08:42:47.518222+00:00"
}
